<?xml version="1.0" encoding="utf-8" ?>

<ResourcePool   xmlns:xsi="http://www.w3.org/2001/XMLSchema-instance"
				xsi:noNamespaceSchemaLocation="Resource_pool.xsd">

	<Resource xml:id="Resource_1" age="P32Y" maritalState="verheiratet" weeklyHours="PT35H" yearlyTimeOf="P28D" commuteTime="PT20M" workExperience="P13Y" trainingDuration="P3Y" overtime="PT50H" yearlyEducation="P5D">
		<!--Personal Background-->
		<Photo path="../images/Resource_1.jpg"/>
		<FirstName value="Anna"/>
		<LastName value="Schmidt"/>
		<Child age="P5Y"/>
		<Child age="P3Y"/>
		<PersonalInfo value="Beide Kinder gehen in die Krankenhaus-Kita"/>
		<!--Professional Background-->
		<Profession value="Stationsschwester"/>
		<Department value="Onkologie"/>
		<Training value="Notfall Medizin"/>
		<Training value="Anästhesie"/>
		<Qualification value="Ausbildung als Labortechnikerin"/>
		<WorkAgreement value="0-22:00-06:00"/>
		<WorkAgreement value="1-22:00-06:00"/>
		<WorkAgreement value="2-22:00-06:00"/>
		<WorkAgreement value="3-22:00-06:00"/>
		<WorkAgreement value="4-22:00-06:00"/>
		<WorkAgreement value="0-06:00-12:00"/>
		<WorkAgreement value="1-06:00-12:00"/>
		<WorkAgreement value="2-06:00-12:00"/>
		<WorkAgreement value="3-06:00-12:00"/>
		<WorkAgreement value="4-06:00-12:00"/>
		<Studies name="berufsbegleitendes Studium der Medizin" location="Mainz"/>
		<AdditionalJob name="Mitglied im Personalrat"/>
		<MeansOfTransport value="öffentliche Verkehrsmittel"/>
		<MeansOfTransport value="Fahrrad"/>
		<!--Skills-->
		<Skill value="Medikamentierung"/>
		<Skill value="Diagn. Schnelltest"/>
		<Skill value="Dokumentation"/>
		<!--Character Traits-->
		<Trait name="Zuverlässigkeit" value="85"/>
		<Trait name="Entscheidungsvermögen" value="25"/>
		<Trait name="Belastungsfähigkeit" value="65"/>
		<Trait name="Veränderungsbereitschaft" value="85"/>
	</Resource>
	<Resource xml:id="Resource_2" age="P41Y" maritalState="Verheiratet" weeklyHours="PT20H" yearlyTimeOf="P20D" commuteTime="PT30M" workExperience="P14Y" yearlyEducation="P10D" overtime="PT150H" trainingDuration="P10Y">
		<!--Personal Background-->
		<Photo path=".\\images\\Resource_2.jpg"/>
		<FirstName value="Erika"/>
		<LastName value="Müller"/>
		<Child age="P11Y"/>
		<Stressor value="Pflege der kranken Eltern"/>

		<!--Professional Background-->
		<Profession value="Oberärztin"/>
		<Department value="Onkologie"/>
		<WorkAgreement value="0-06:00-12:00"/>
		<WorkAgreement value="1-06:00-12:00"/>
		<WorkAgreement value="2-06:00-12:00"/>
		<WorkAgreement value="3-06:00-12:00"/>
		<WorkAgreement value="4-06:00-12:00"/>
		<WorkAgreement value="5-06:00-12:00"/>
		<WorkAgreement value="6-06:00-12:00"/>
		<AdditionalJob name="Wissenschaftlicher Beirat" yearlyRequiredDays="P5D"/>

		<!--Skills-->
		<Skill value="Tumorentfernung"/>
		<Skill value="Anamese"/>
		<Skill value="Nachkontrolle"/>
		<Skill value="Dokumetation"/>

		<!--Character Traits-->
		<Trait name="Zuverlässigkeit" value="85"/>
		<Trait name="Entscheidungsvermögen" value="95"/>
		<Trait name="Belastungsfähigkeit" value="30"/>
		<Trait name="Veränderungsbereitschaft" value="10"/>
	</Resource>
	<Resource xml:id="Resource_3" age="P48Y" maritalState="Ledig" weeklyHours="PT15H" yearlyTimeOf="P18D" commuteTime="PT35M" workExperience="P35Y" trainingDuration="P3Y" overtime="PT10H" yearlyEducation="P3D">
		<!--Personal Background-->
		<Photo path="..\\images\\Resource_3.jpg"/>
		<FirstName value="Hilde"/>
		<LastName value="Mayer"/>
		<Child age="P21Y"/>

		<!--Professional Background-->
		<Profession value="Verwaltungsfachangestellte"/>
		<Department value="Onkologie"/>
		<Department value="Geriatrie"/>
		<WorkAgreement value="0-06:00-12:00"/>
		<WorkAgreement value="1-06:00-12:00"/>
		<WorkAgreement value="2-06:00-12:00"/>
		<!--Skills-->
		<Skill value="Schichtplanerstellung"/>
		<Skill value="Registratur"/>
		<Skill value="SAP-Abrechnungssystem Medikamente"/>

		<!--Character Traits-->
		<Trait name="Zuverlässigkeit" value="90"/>
		<Trait name="Entscheidungsvermögen" value="15"/>
		<Trait name="Belastungsfähigkeit" value="15"/>
		<Trait name="Veränderungsbereitschaft" value="10"/>
	</Resource>
</ResourcePool>